title,company-name,location,type,salary_package,company_requirements
IT US Recruiter (Night Shift),Finezi,"Udipi, Karnataka",N/A,"₹15,000 - ₹40,000","Candidates without past experience of working continuously with one company for at least 3 to 4 years , should not apply."
Mastering Technician (A.V Editor/ Text Conformance),"PREMIERE DIGITAL SERVICES, INC","Bangalore Urban District, Karnataka",Full-time,N/A,"Performing edits on Episodes, Features, Trailer, and Trailer Clip based on QC notes and create an error free output for digital distribution."
IT& ART Teacher,Shree Swaminarayan Gurukul International School...,"Jadcherla, Andhra Pradesh",Monday to Friday ,N/A,"Ed with Minimum 3 yrs Experinece.
Good in Communication Skills, Subject Knowledge, & Behaviour.
Job Types: Full-time, Permanent.
Total work: 1 year (Preferred)."
MNC COMPANY IS HIRING -DAY SHIFT,HGS,"Bengaluru, Karnataka",Full-time,N/A,"Qualifications Bcom,BBM,BBA,BSC,MBA,MA,MCA,MSC,BA, BE,…"
Executive Assistant,Wing AI,Remote,N/A,₹250 - ₹450,"Benefits of both worlds - Enthusiasm & Learning curve of a Start-Up, Deliveries & Performance of an Enterprise Service Provider.
Total work: 1 year (Preferred)."
Amazon Product Listing Coordinator,Heritage Baby Products,"Hyderabad, Telangana",Full-time ,N/A,"Managing Amazon product listing - product setup - listing optimization etc.
Preferred if experienced in Amazon ad management or other similar ecom companies."
Work from home opportunity,Sagar Enterprenuers,"Remote in Warangal, Telangana",N/A,"₹40,000 - ₹50,000","Job Types: Full-time, Permanent.
Warangal, Telangana: Reliably commute or planning to relocate before starting work (Required)."
Executive - Customer Service,WorldWide Logistics India Pvt Ltd,"Bengaluru, Karnataka",Full-time ,N/A,"Freight Forwarding - Customer Support for AIR & SEA - Import and Export.
Years of Experience - 2-4 Years.
Job Types: Full-time, Permanent, Fresher."
Social Media Customer Service,Frido,Remote,Monday to Friday ,N/A,"Collaborate with internal teams to address complex customer concerns.
Provide feedback to improve customer service processes."
Content Writer (Work from Home),Nestsoft technologies,Remote in India,N/A,"₹50,000","Should have experience in working with SEO Writing, Articles, blogs web contents etc.
This person will be responsible for writing the content for several types…"
"Transcriber (General,legal,Business) -Work from Home Full time",EarningsScript Pvt.Ltd.,Remote,Full-time ,N/A,"Adhering to the industry practices and confidentiality guidelines at all times.
Translating the recorded audio hearings into text documents."
Assistant Supervisor,Prashant Enterprise,"Jammu, Jammu and Kashmir",N/A,N/A,And age 18+ my team full sported right now*.
Data Entry Executive,Chandan Tech Solutions Pvt ltd,"Pune, Maharashtra",N/A,"₹25,000 - ₹38,000","Compiling, verifying accuracy and sorting information to prepare source data for computer entry.
Entering customer and account data from source documents within…"
English Language Assessment Expert,Hurix Digital3.4,"Hybrid work in Nanakramguda, Hyderabad, Telangana",Full-time,N/A,"Develop clear and measurable assessment goals and criteria.
Create assessment content that aligns with established objectives and standards."
Content Writer,Teaddle Media,Remote,N/A,N/A,"Brainstorm and generate content ideas that align with each client's brand, audience, and goals.
Pay scale: ₹25,000-₹35,000/month + Bonus."
Assistant Supervisor,Web discovery winds,Remote,N/A,"₹15,000 - ₹20,000","The Assistant Supervisor is responsible for assistant the supervisor in the day to day operations of the company, including managing the training of team…"
Wildlife Camp Naturalists / Birders,TigerTrails,India,N/A,N/A,"Our wildlife safaris consists of morning and evening trips into national parks, special visits to tribal villages and local events for our Indian and overseas…"
Online Spoken English Tutor,eTutorszone.com,Remote,N/A,N/A,"Spoken English Teaching: 3 years (Preferred).
Proficiency in English language (native or near-native fluency preferred)."
Tele Sales Executive-work from Home,Webcrstravel Technologies Pvt Ltd,"Remote in Kochi, Kerala",N/A,₹400 - ₹600,"Most importantly, a tele sales needs to follow up with the customer on what they had discussed in the last phone call.
Direct sales: 1 year (Preferred)."
Social Media Intern,Allo Innoware,Remote,Part-time,N/A,"Work closely with graphic designers to get social media posts done.
Give various copywriting content as per the creatives and campaign for social media."
Social Media Handler,Abhishek Technologies,Remote,N/A,N/A,"Ability to create engaging posts for our Facebook business account.
Craft and post at least 1 daily update on our Facebook business account, focusing on…"
Pre - Sales - US Shift,Bhanzu,Remote,N/A,"₹12,000 - ₹15,000","Learning & using our customer relations management software & others related computer.
Collating and maintaining client information in the CRM database."
Tamil Native Speaker,Tutornet Solutions Pvt Ltd,Remote,Full-time,N/A,"Able to commit to working daily for at least 3 to 3.5 hours.
Ensure sentences are grammatically correct, complete, and articulated clearly."
Freelance Copy Editor,Ansrsource,Remote,N/A,N/A,"As a Copy Editor, you will be responsible for reviewing and editing written content for grammatical accuracy, clarity, and consistency."
Virtual Assistant (WFH/Remote),Growup Group,Remote,N/A,"₹7,000 - ₹10,000","You will be assigned a client once you are nearing the completion of your training.
A VA will be trained in all the domains enlisted below, and depending on…"
Customer Support Executive- Voice Process- Work From Home,Reliance SMSL limited,"Remote in Palakkad district, Kerala",Full-time,N/A,"Capture customer details and data relevant to the call or service.
Respond to all customers in appropriate tone and language."
Executive Assistant to CEO,FAITH DIGITAL MEDIA,Remote,N/A,"₹30,000 - ₹35,000","Self starter and an Independant worker.
We are looking for a Virtual/ Executive Assistant to provide administrative support while working remotely."
Computer Scientist,Adobe4.3,"Bengaluru, Karnataka",Full-time,N/A,"Experience : 3-5 years of software engineering experience, including at least 2 years in integrating machine learning models and maintaining ML pipelines,…"
Hindi Content Writer,An services Pvt ltd,Remote,N/A,N/A,"Job Types: Full-time, Part-time, Permanent.
Total work: 1 year (Preferred)."
Customer Service Representative,Times Internet Limited,Remote,N/A,"₹7,000 - ₹9,000",1.You will have the responsibility of taking complete ownership in sorting out the queries of the prospective /existing investors so that he/she can invest …
Work from Home IT Counselors,Nestsoft technologies,Remote in India,N/A,"₹5,000 - ₹8,000","Furthermore, you will oversee trainers' management, including recruiting, scheduling, and maintaining good working relationships with them to ensure high…"
E-Commerce Intern,Big Internet Seller Service Inc,Remote,Full-time ,N/A,"-Create product listings on sites like eBay, Amazon etc. for our clients-Prepare large excel sheets with various prices and snazzy formulae-Coordinate with…"
"Amazon, Flipkart & DropShipping Expert",Webtech Solutions,Remote,Monday to Friday ,N/A,"Trend Analysis: Stay informed about e-commerce trends, platform updates, and industry shifts to keep our strategies innovative and competitive."
Virtual Assistant (Remote),Growup Group,Remote,N/A,"₹20,000 - ₹30,000","You will be assigned a client once you are nearing the completion of your training.
A VA will be trained in all the domains enlisted below, and depending on…"
Astrology Content Writing: Prefers Astrologers Proficient English Writing (Part Time),Ennexa Technologies,Remote,Part-time ,N/A,"The ideal candidate should possess a deep understanding of Vedic astrology principles and practices, along with strong English writing skills."
Assistant Supervisor,ByteBay,Remote,N/A,N/A,"In this role, you will play a key part in supporting the day-to-day operations and ensuring the success of our team.
Job Types: Full-time, Part-time, Fresher."
Email/ Chat Process(International),Zoopero Marketing Private Limited,"Pune, Maharashtra",N/A,"₹20,000 - ₹30,000","Escalate complex issues to higher-level support or relevant departments when necessary.
Job Summary*: As an Email and Chat Support Executive, your primary…"
Virtual Admin,Conversely,Remote,Full-time ,N/A,"Good English proficiency– speaking and writing*, Honest, Reliable, Attention to detail, Resourceful, Ability to multi-task, handle challenges well, dependable,…"
Associate- Category,Goodera,"Bengaluru, Karnataka",N/A,N/A,"Develop creative and engaging volunteering activities and initiatives that cater to.
Identify and create new volunteering programs that align with budget and…"
"IT Counselor (Work from Home) Hindi, Tamil, Malayalam",Nestsoft technologies,Remote in India,N/A,"₹16,500","We pay basis on the admission taken by you.
Skills Required: Should have basic skills in IT, Online and Software Courses."
University Representative - EUROPE,VINTAGE IMMIGRATION,Remote,Full-time ,N/A,"Establish and maintain positive, productive relationships with education agents, counsellors, and international education consultants."
Office Admin,KoiReader Technologies,Remote,N/A,N/A,"Minimum 1 year of experience in an administrative role (or relevant experience).
Manage day-to-day office operations and organize company documents, records,…"
"Back Office Executive,Andheri",Anand Agencies,"Andheri, Mumbai, Maharashtra",N/A,"₹15,000 - ₹25,000","The ideal candidate will be responsible for accurately entering data into our systems, ensuring data integrity, and supporting various administrative tasks."
Data Entry Operator,Swaniti Initiative,"Jamshedpur, Jharkhand",Part-time ,N/A,"Our interventions have included strengthening scheme implementation by identifying current gaps and limitations, providing research support to Hon’ble Members…"
Home tuitions,Velocity classes (Individual concept learning),"Bengaluru, Karnataka",Monday to Friday ,N/A,"Communicate effectively with parents/guardians to discuss student performance and address any concerns.
Responsibilities *: Conduct one-on-one tutoring sessions…"
Data Entry Operator,Swaniti Initiative,"Jamshedpur, Jharkhand",Full-time,N/A,"Our interventions have included strengthening scheme implementation by identifying current gaps and limitations, providing research support to Hon’ble Members…"
Academic Counselor (Work from Home),Nestsoft technologies,Remote in India,N/A,N/A,"Should have basic skills in IT Technologies is an added advantage.
Skills Required: Should have skills in counselling of any type courses / recruitments."
Customer Service New Associate,Accenture,"Bengaluru, Karnataka",N/A,"₹16,000 - ₹20,000","The responsibility of an advisor as customer service associate will be to assist our customers end to end for any queries around billing, package related and…"
Associate – Accounts,ThinkRobotics,Delhi,Full-time,N/A,"As an Associate - Accounts, you will handle all the company's basic accounting duties and administrative tasks.
Total work: 3 years (Preferred)."
"Virtual Customer Support Associate - West Bengal, India",Amazon.com,Remote in West Bengal,N/A,N/A,"You’ll be the first point of contact for our customers by answering their requests through phone, chat and/or email – this includes everything from order and…"
Service Officer-BRANCH BANKING-Branch Banking,Kotak Mahindra,"Bengaluru, Karnataka",Full-time,N/A,"Redress customer needs pertaining to cash, DDs, cheque deposits, general information.
Providing quality of experience that will ensure retention and positive…"
Junior Clerk,Vinayaga Industries,"Tirunelveli, Tamil Nadu",N/A,"₹24,000 - ₹35,000","Monitor and manage payroll, accounting, human resources, and other activities.
Prepare financial reports and oversee payables and receivables."
Home tuitions,RightTutor,"Bengaluru, Karnataka",Full-time ,N/A,"Job Type: Part-time/Full-time*.
Tutors will either travel to the student’s home or host lessons at their own place.
Assess and monitor student progress."
Assistant Supervisor,Believers organisation,"Shahjahanpur, Uttar Pradesh",N/A,N/A,"IDENTIFYING,QUALIFICATION AND SECURING BUSINESS OPPORTUNITY COORDINATING BUSINESS GENERATION ACTIVITIES .
CREATING AND MAINTAINING A LIST/DATABASE OF PROSPECT…"
Tea Factory Assistant,IG Group,"Dum Duma, Assam",N/A,"₹15,443.21 - ₹76,173.88","Supervision, Planning, Maintenance, and Management of Tea Manufacturing Factory.
Must have knowledge of Manufacturing of both Orthodox and CTC Teas."
Telesales Executive (Tamil),TECHMILE SYSTEMS PRIVATE LIMITED,Remote,Part-time,N/A,"Keep records of calls and sales and note useful information.
Enter and update customer information in the database.
Job Types: Full-time, Fresher."
Camp Admin Supervisor,Ambey Mining Pvt Ltd,"Dhanbad District, Jharkhand",N/A,N/A,Ensuring that we deliver high quality service (Accommodation & fooding) to the staff and other guests from different sites/ Guest Houses.
voice process (Tamil),TECHMILE SYSTEMS PRIVATE LIMITED,Remote,N/A,"₹15,000 - ₹20,000","Maintain excellent customer satisfaction and review support.
Provide customer support through phone.
Proactively identify, investigate, and resolve recurring…"
Content Editor,Text Mercato,"Bengaluru, Karnataka",Full-time ,N/A,The company prides itself on disrupting the industry with its dedicated B2B content platform that leverages technology and sound processes to ensure timely…
Site Supervisor,MKS Electrical & Interiors Pvt. Ltd,"Gorakhpur, Uttar Pradesh",N/A,N/A,"Ensures customer needs are met and high quality service is delivered through a variety of means, including staff meeting or exceeding service levels and through…"
Wayfair Online Product Listing Coordinator,Heritage Baby Products,Remote,N/A,"₹50,000","Should have experience in managing Wayfair or Amazon product listing - product setup - listing optimization etc.
Part-time hours: 40 per week."
Social Science & Science Teacher,Nandha Gokulam Life School,"Nellore, Andhra Pradesh",Full-time,N/A,"To ensure academic excellence in classes responsible for.
To provide guidance to the teachers reporting to the position in planning, designing and implementing…"
Assistant Supervisor,Insha Enterprises Group,"Chhatarpur, Madhya Pradesh",N/A,"From ₹17,000","Manage, train, and monitor team members and team leads.
Providing training to employees, ensuring company policies are followed organizing employee schedule,…"
"Find A New Career, You'll Love",Proeffico Solutions,"Remote in Noida, Uttar Pradesh",N/A,N/A,"Continuous learning, certifications, networking, and taking on challenging projects can help you progress.
Software engineers, web developers, data analysts, QA…"
Coordinator,AGS Technologies (India) Pvt Ltd,"Pimpri-Chinchwad, Maharashtra",Monday to Friday,N/A,"Create, compile and export databases containing all information for each event.
Answer telephones and respond to inquiries from clients and participants."
Executive Assistant,Musclestadt Sporternaerung India Private Limited,Remote,Full-time ,N/A,"Serve as the primary point of contact for internal and external constituencies on all matters pertaining to the CEO, including those of a highly confidential or…"
Presales Executive(Freshers also can apply),MAHENDRA HOMES PVT LTD,"Bengaluru, Karnataka",N/A,"₹22,000 - ₹30,000","Pitch solutions to a customer and explain all the features and benefits of our service.
Assist the sales team in qualifying potential customers."
Content Writing Jobs - Jobs For Content Writing,Techasoft,Remote,Full-time ,N/A,"Write clear marketing copy to promote our products/services.
Identify customers’ needs and gaps in our content and recommend new topics."
Science tutor,Homeclass,Remote,N/A,N/A,"8.Time Availability 6-7 am and 4-10 pm IST.
Minimum 5 years of experience of teaching kids, either in school or reputed tutorial home or EdTech 3."
Ticketing Executive,FUTURE TICKETING GROUP PRIVATE LIMITED,"Delhi, Delhi",N/A,"₹18,000 - ₹30,000","Assist customers with problems that may arise during travel.
Assist customers in booking flights, including providing information on available airlines, flight…"
Office Assistant,Techcruz Technologies,Remote,Full-time,N/A,The ideal candidate will be a hard-working professional able to undertake a variety of office support tasks and work diligently under pressure.
Billing Executive,K Corp,"Koni, Kerala",N/A,N/A,"Knowledge in Malayalam typing would be an added advantage.
Second shift : 11am to 7pm.
Billing & Data Entry Executive- cum- Cashier*."
Data Entry Operator/Computer Operator,Tring,"Hybrid work in Tenkasi, Tamil Nadu",N/A,₹250,"This role requires a higher level of proficiency and attention to detail.
Proven experience (2-3 years) in data entry or administrative roles."
Shift Supervisor,Starbucks,"Ahmedabad, Gujarat",Contractual / Temporary,N/A,"Follows TATA Starbucks operational policies and procedures, including those for cash handling and safety and security, to ensure the safety of all partners…"
"Virtual Customer Support Associate -KA, India",Amazon.com,Remote in India,N/A,"₹21,664.45 - ₹28,783.28","In order to match our customer demand, we schedule based on a variety of different shift patterns within the operating hours of 6 am and 11 pm Sunday to Monday."
CONTENT WRITER,Adherence And Edvisor Education Management System...,Remote,N/A,"₹18,000 - ₹22,000","Type: Full Time / Part Time/ Remotely Flexible.
Hours: Minimum of 6 hours per day.
Salary*: ₹6,000 - ₹8,000 (Based on quality and deliverables)."
Front Office Executive,Ravishing Retreat LLP,"Ramanagaram, Karnataka",Full-time,N/A,"Answer questions and address complaints.
Keep front desk tidy and presentable with all necessary material (pens, forms, paper etc.)."
"Back Office Executive,Andheri",Anand Agencies,"Andheri, Mumbai, Maharashtra",N/A,N/A,"The ideal candidate will be responsible for accurately entering data into our systems, ensuring data integrity, and supporting various administrative tasks."
Content Writing Jobs - Jobs For Content Writing,Techasoft,Remote,N/A,"₹16,500","Write clear marketing copy to promote our products/services.
Identify customers’ needs and gaps in our content and recommend new topics."
Home tuitions,RightTutor,"Bengaluru, Karnataka",Full-time ,N/A,"Job Type: Part-time/Full-time*.
Tutors will either travel to the student’s home or host lessons at their own place.
Assess and monitor student progress."
Urgent Hiring || English Evaluator || WFH,NCR Eduservices Pvt Ltd,Remote,N/A,N/A,"In this role, you will play a crucial part in ensuring the quality and effectiveness of our phonics-based reading and pronunciation sessions delivered by…"
Associate – Accounts,ThinkRobotics,Delhi,N/A,"₹15,443.21 - ₹76,173.88","As an Associate - Accounts, you will handle all the company's basic accounting duties and administrative tasks.
Total work: 3 years (Preferred)."
Customer Service Representative - Voice,TTEC,"Mumbai, Maharashtra",Part-time,N/A,"Whether it’s getting answers for customers quickly, consulting on products with compassion or resolving their issues with a smile, you’ll be the difference…"
Cyber Security Intern,Wahy Lab Solutions,"Kochi, Kerala",N/A,N/A,"Job Types: Full-time, Permanent, Fresher."
Data Entry Operator/Computer Operator,Tring,"Hybrid work in Tenkasi, Tamil Nadu",N/A,"₹16,000 - ₹20,000","This role requires a higher level of proficiency and attention to detail.
Proven experience (2-3 years) in data entry or administrative roles."
Chat Support Executive,Astoria Software Exports Pvt. Ltd.,"Remote in Kochi, Kerala",Full-time,N/A,"Rotational Shift 24 x 5 - Candidates can be asked to work in any shift.
First 6 months constitute the probation period and the salary supplied will be Rs."
Customer Support Executive,Gadgeon Medical Systems Pvt Ltd.,Remote,N/A,N/A,"Ensuring maximum customer satisfaction and implementation of our standard practice.
Proactively resolving product or service problems by clarifying the customer…"
Project Coordinator,Big Internet Seller Service Inc,Remote,N/A,"₹30,000 - ₹41,000",Ensure each task is assigned to the appropriate person (i.e. the person who needs to take the next action on the task including reassigning the task to the…
Telly calling,Pachouli Wellness Clinic,"Indore, Madhya Pradesh",Monday to Friday ,N/A,"Prior experience with customer service and call centers in relevant job roles.
Ensure you follow the customer service script provided by the company for…"
Tutoring-Biology,eTutorWorld,Remote,N/A,"₹6,000 - ₹8,000","We are looking for teachers/tutors with teaching experience in Biology.
Graduate or post graduate who can teach Biology."
Assistant Supervisor,Insha Enterprises Group,"Chhatarpur, Madhya Pradesh",N/A,"From ₹17,000","Manage, train, and monitor team members and team leads.
Providing training to employees, ensuring company policies are followed organizing employee schedule,…"
Sales Executive,Fitelo,Remote,N/A,N/A,"Keeping records of calls and sales and note useful information.
Entering and updating customer information in the database.
Job Types: Full-time, Permanent."
Customer Service Executive,YEHMERAINDIA/Gharsoaps,"Narhe, Pune, Maharashtra",Monday to Friday,N/A,The ideal candidate will have excellent communication and convincing skills to manage customer inquiries and ensure a high level of customer satisfaction.
Customer service representative,Drimlite,"Pune District, Maharashtra",N/A,"Up to ₹25,000","Maintain a high level of product knowledge to address customer queries accurately.
Both freshers and experienced candidates are welcome to apply."
Content Writer,Research Nester Pvt. Ltd.,Remote,Full-time ,N/A,"Hours: 10 AM to 7 PM.
Preparing, rewriting, or editing content to improve readability while adhering to the in-house guidelines."
Agronomist (Male),Veg Ease,"Gurugram, Haryana",N/A,"₹10,000 - ₹20,000","The Agronomist will play a crucial role in improving crop yields, advising on best practices, and contributing to sustainable agricultural development."
Freelance Content Writer,Vadavision! Consultancy Inc.,Remote,Full-time ,N/A,"Stay updated with industry trends and best practices in technical writing and SEO.
Ensure all content is consistent with our brand voice, style, and tone."
Front Office Executive (Receptionist),CRE Spacez,"Bengaluru, Karnataka",N/A,"Up to ₹40,000","§ Handle client queries & address complaints politely.
§ Responsible for handling front office and client relations activities."
Tele Caller Executive,PJ Group,Remote,Full-time,N/A,"Identifying qualifying and securing business opportunities , coordinating business generation activities.
Maintaining a list base of prospect client."
Social Science & Science Teacher,Nandha Gokulam Life School,"Nellore, Andhra Pradesh",N/A,N/A,"To ensure academic excellence in classes responsible for.
To provide guidance to the teachers reporting to the position in planning, designing and implementing…"
Back Office Coordinator,Vinayaga Industries,"Virudunagar, Tamil Nadu",N/A,"₹40,000 - ₹80,000","Gathering and processing research data.
Performing basic admin duties including printing, sending emails, and ordering office supplies."
Student Advisor - Work from Home,Edubex,Remote in India,Full-time,N/A,"We are looking for Student advisors - (Work from home), who can join us immediately.
Must have sales experience - preferably in finance/banking/education/study…"
Data Entry Operator ( Fresher),Tring,"Hybrid work in Tenkasi, Tamil Nadu",N/A,N/A,"As a Data Entry Operator (Fresher), you will be responsible for inputting, updating, and maintaining accurate data within our systems."
Non-Voice/ Back office Agent,"TSI - Transworld Systems, Inc (India)","Bengaluru, Karnataka",N/A,"₹15,000","Transport facility (Depends on policy and shift).
Graduate Fresher’s or HSC + Minimum 6 months of experience.
Maintain confidentiality and security of sensitive…"
Content Moderator,ImpactHub Connect,Remote,Part-time,N/A,"Collaborate with cross-functional teams, including Community Managers and Clients, to address content-related issues and implement improvements."
Cognos Admin- 24010549,MoneyGram3.7,"Mumbai, Maharashtra",Full-time,N/A,"Implement innovative BI and mobile BI solutions and platform configurations to meet emerging industry trends or customer needs.
Stay healthy and worry-free!"
ASSISTANT SUPERVISOR,SUNRISE CONSTRUCTION COMPANY,Remote,N/A,N/A,"Good in the cleaning industry.
This is a part-time remote role for an Assistant Supervisor at Sunrise Construction Company.
Job Types: Full-time, Part-time."
Shift Incharge,Ambey Mining Pvt Ltd,"Dhanbad, Jharkhand",N/A,"₹10,000 - ₹20,000","Ensure that haul road, dumping and working area to be maintained properly for the better output and less breakdown of equipments."
Meme Creator,Zepp Media,Remote,Full-time ,N/A,"Develop and design original memes that are engaging, relevant, and tailored to our target audiences on LinkedIn, Instagram, and Facebook."
Science tutor,Homeclass,Remote,N/A,N/A,"8.Time Availability 6-7 am and 4-10 pm IST.
Minimum 5 years of experience of teaching kids, either in school or reputed tutorial home or EdTech 3."
Front Desk Receptionist,ADVANCED GRO HAIR,"HSR Club, Karnataka",N/A,"₹5,000 - ₹7,000","You have attend phone calls, answer inquiries, and assist patients in filling up documents.
The front office staff is responsible for receiving and greeting the…"
SGT Computer Science,Velammal New Gen Edu Network2.0,"Chennai, Tamil Nadu",Part-time,N/A,"Teach Computer Science to Classes VI to X, ensuring that students understand both theoretical and practical aspects of the subject."
