title,company-name,location,type,salary_package,company_requirements
IT Fresher,Rapport IT Services,"Tiruchchirappalli, Tamil Nadu",N/A,"₹8,000 - ₹10,000","Participate in training programs to develop recruiting skills and industry knowledge.
Collaborate with the recruitment team to understand client requirements…"
Online Physics High School,eTutorszone.com,Remote,Full-time,N/A,"Can work early morning hours (US shift).
We help students throughout the United States who are preparing for the K-12 (Math, English, Science) and SAT, ACT, and…"
Customer Relationship Executive,Quess Corp Limited,"Shillong, Meghalaya",N/A,"₹15,000 - ₹20,000","Customer service: 1 year (Preferred).
Job Role- Selling telecom product at Store,.
Required min 1 yr Sales experience."
Content Writing Intern,Zepp Media,Remote,Full-time,N/A,"Conduct research to stay informed about industry trends and incorporate relevant insights into content creation.
Job Types: Part-time, Internship."
"Accounts Assistant , Bengaluru - India",Evertz Microsystems Limited,"Bengaluru, Karnataka",N/A,N/A,"Under the GDPR, you have the right to request access to your personal data, to request that your personal data be rectified or erased, and to request that…"
Audit Assistant,Sanjay Kadel & Co. Chartered Accountants,"Kilpauk, Chennai, Tamil Nadu",N/A,"₹18,000 - ₹27,000","You should have prior experience of atleast 2 years in an audit firm, and knowledge of Accounting, Income Tax, TDS, GST, etc.
Job Types: Full-time, Permanent."
Biker delivery executive - Powai /Bandra,Mapro Ventures Ltd,"Mumbai, Maharashtra",Full-time ,N/A,"Petrol allowance of Rs 3 per km plus Rs 6 per pickup *.
Do billing at store and home pickups and delivery.
Local home delivery and pickup."
Administrative Assistant,World Gateway Immigration,"Ludhiana, Punjab",N/A,N/A,"Capable of working in a fast paced office environment.
Experience with Microsoft Office (Word and Excel), ability to adapt to different software and programs;…"
Data Researcher,Funfull Inc.,"Ahmedabad, Gujarat",N/A,N/A,"As a Data Researcher, you will play a crucial role in analyzing financial data and providing actionable insights to support our business development efforts."
Service Technician,Travancore Industrial Solutions,"Kochi, Kerala",N/A,"₹18,000 - ₹26,500","On job training will be provided ..
Qualification: - Degree or Diploma in Mechanical,Electrical/ITI Fitter.
Ernakulam, Kerala: Reliably commute or planning to…"
Chemistry facilitator,GreenValley International School Trivandrum,"Thiruvananthapuram, Kerala",Full-time,N/A,"Encourage the students to be actively engaged in self-learning and review their progress on a weekly basis.
Basic knowledge of technology-aided teaching tools…"
International Sales Executive,V GLOBAL,"Hybrid work in Mumbai, Maharashtra",N/A,N/A,"Networking Opportunities*: Represent V Global at industry events.
1 year of sales experience, ideally in B2B or international markets."
Sales Executive,meditek engineers Pvt. Ltd.,"Tiruchchirappalli, Tamil Nadu",N/A,N/A,"Identifies product improvements or new products by remaining current on industry trends, market activities & competitors.
Report to your manager daily."
Cameraman,Institute of Rheumatology and Immunology Sciences...,Kerala,N/A,"₹15,000 - ₹25,000","The ideal candidate will have 3-5 years of professional experience in videography, with a passion for capturing high-quality footage that effectively…"
PGT English Teacher ( Dhanbad ),Montfort Academy4.6,"Dhanbad, Jharkhand",Full-time,N/A,"English teaching: 3 years (Required).
Candidadate should have degree as per CBSE norms and also should have good command in speaking and wring English."
English FemaleTeacher,SAM-Seriously Addictive Maths,"Powai, Mumbai, Maharashtra",N/A,N/A,"Prepare materials and activities.
Total work: 3 years (Preferred).
Should be able to cater the students falling in the age group from 4-10 years."
EdTech Sales || Bangalore,Darkstore Retail Pvt. Ltd,"Indiranagar, Bengaluru, Karnataka",N/A,"₹40,000 - ₹70,000",Market Knowledge: Stay informed about industry trends and competitor activities to effectively position our products.
UNGM Tender Executive,Anand Surgical Enterprises,"Chandigarh, Chandigarh",Full-time ,N/A,"Strong technical understanding of relevant products and industry standards.
Anand Surgical Enterprises is a healthcare, military safety equipment, and…"
Sales and Marketing Executive,TechAvidus Private Limited,"Gandhinagar, Gujarat",N/A,N/A,"Stay updated on industry trends, competitor activities, and customer needs.
Ability to build and maintain long-term customer relationships and provide…"
Assistant Store Incharge (Rs 10000 -15000 salary) (10+2)(+2yr exp),"MMK Enterprises Pvt Ltd vpo ballan adda ,...","Jalandhar, Punjab",N/A,"₹8,000 - ₹10,000",Entry in accounting software tally Prime and preparing sale delivery challan to sale bill and gate pass . dhank report .
Executive Assistant to CEO,Rhea Mehta Design,"Mumbai, Maharashtra",N/A,"₹15,000 - ₹20,000",Prepare internal and external corporate documents for team members and industry partners Schedule meetings and appointments and manage travel itineraries.
Sales Representative,vibcare pharma,"Panchkula, Haryana",Full-time,N/A,"Educational Background: Bachelor's degree in business, marketing, or a relevant field.
Client Engagement: Develop and sustain relationships with clients,…"
Performance Marketer,Neethu's Academy,"Kochi, Kerala",N/A,N/A,"Minimum of 2-3 years of experience in performance marketing.
Maintain strong working relationships with external vendors and partners."
Sales and Marketing Executive,GARDEN OF EDEN PROPERTY DEVELOPERS PRIVATE LIMITED,"Madhapur, Hyderabad, Telangana",N/A,"₹18,000 - ₹35,000","The ideal candidate should have a proven track record in real estate sales, excellent communication skills and a strong understanding of the local real estate…"
Field Sales Executive,shyam quality products,"Ganapathi, Coimbatore, Tamil Nadu",Full-time ,N/A,"Salary mention* as 20000 per month – 30000 per month ( depending up on the work).
Getting repeat orders and showing increase in sales by repeated follow ups…"
AI TRAINER,STEM ROBOTICS INTERNATIONAL,"Thiruvananthapuram, Kerala",N/A,N/A,"Ability to explain complex AI concepts in an accessible manner.
We are seeking a highly skilled and motivated AI Trainer to deliver engaging and informative AI…"
Primary English Teacher,Emmanuel sugnana jyothi high school,"Kammanahalli, Bengaluru, Karnataka",N/A,"₹1,80,000 - ₹4,00,000","Keep an eye on the behavior and psychology of the students to understand any downfalls.
Record and evaluate the development of each student."
igcse Biology,"Sri Krish International School,Kovur","Kovur Road, Chennai, Tamil Nadu",Full-time,N/A,"Total work: 3 years (Preferred).
Teach Biology to senior secondary students (AS & Alevel ).
Develop and implement engaging lesson plans in accordance with the…"
Interior Designer,HomeStyles,"Hyderabad, Telangana",N/A,N/A,"As an Interior Designer, you will collaborate with our team to develop and present cutting-edge designs that meet the needs of our clients."
Teaching Faculty,"176,KK. NAGAR MADURAI.....VENDHAN IAS ACADEMY.ph-...","K. K. Nagar, Madurai, Tamil Nadu",N/A,"₹25,000 - ₹30,000","Stay updated with the latest exam patterns, syllabus changes, and industry trends.
Mentor and guide s students for above subjects along with for various…"
Tour Executive ( Female Candidates),Series Tours,"Angamali, Kerala",Full-time,N/A,"Develop and design tour itineraries based on client requirements, preferences, and budget.
Provide recommendations, answer queries, and address concerns."
Line Cook/Prep Cook,Big Poppas Hospitality and Entertainment Pvt.Ltd,"Thiruvananthapuram, Kerala",N/A,N/A,"Food Preparation and Presentation: Assist the Chef in daily kitchen operations, maintaining high standards of food preparation and presentation."
Junior Graphic Designer,Medica Institute Private Limited,"Ahmedabad, Gujarat",N/A,N/A,"The ideal candidate will have at least one year of experience in graphic design, with a preference for those who have previously worked in a law firm."
Real Estate Sales Executive,Green Hill Group,"Shiliguri, West Bengal",N/A,"₹20,000 - ₹30,000","Build strong client relationships and provide property consultations.
Negotiate deals and ensure client satisfaction.
Job Types: Full-time, Permanent."
Office Assistant,"B. N. KEDIA & CO, Chartered Accountant","Slabatpura, Surat, Gujarat",Full-time,N/A,"Office Assistance having knowledge of Microsoft Excel, Word, etc.
Job Types: Full-time, Permanent, Fresher.
Microsoft Office: 1 year (Preferred)."
Teaching Faculty,"176,KK. NAGAR MADURAI.....VENDHAN IAS ACADEMY.ph-...","K. K. Nagar, Madurai, Tamil Nadu",N/A,"₹10,000 - ₹15,000","Stay updated with the latest exam patterns, syllabus changes, and industry trends.
Mentor and guide s students for above subjects along with for various…"
Tour Executive ( Female Candidates),Series Tours,"Angamali, Kerala",Part-time,N/A,"Develop and design tour itineraries based on client requirements, preferences, and budget.
Provide recommendations, answer queries, and address concerns."
Line Cook/Prep Cook,Big Poppas Hospitality and Entertainment Pvt.Ltd,"Thiruvananthapuram, Kerala",N/A,N/A,"Food Preparation and Presentation: Assist the Chef in daily kitchen operations, maintaining high standards of food preparation and presentation."
Office Assistant,"B. N. KEDIA & CO, Chartered Accountant","Slabatpura, Surat, Gujarat",N/A,"₹12,000 - ₹20,000","Office Assistance having knowledge of Microsoft Excel, Word, etc.
Job Types: Full-time, Permanent, Fresher.
Microsoft Office: 1 year (Preferred)."
Junior Graphic Designer,Medica Institute Private Limited,"Ahmedabad, Gujarat",Full-time ,N/A,"The ideal candidate will have at least one year of experience in graphic design, with a preference for those who have previously worked in a law firm."
Real Estate Sales Executive,Green Hill Group,"Shiliguri, West Bengal",N/A,N/A,"Build strong client relationships and provide property consultations.
Negotiate deals and ensure client satisfaction.
Job Types: Full-time, Permanent."
Social Science Teacher,Aaytan Academy,"Ahmedabad, Gujarat",N/A,N/A,"O Bachelor's degree or higher in related field.
O Minimum of 3 years of SST teaching experience(prefered) for the same position."
Graphic Designer,Fashen Hub,"Topsia, Kolkata, West Bengal",N/A,"₹12,000 - ₹16,000","You will work closely with our marketing, product, and design to develop engaging visuals that align with our brand identity and business objectives."
Field Executive,Thefarmergroups,"Korattur, Chennai, Tamil Nadu",Full-time,N/A,"Education and training: Companies generally expect candidates to have a bachelor's degree for this role, although some may accept those with relevant…"
Customer Relationship Executive,GRACE ACADEMY,"Aluva, Kerala",N/A,N/A,"Meet call handling quotas and individual and team sales targets.
Ensuring regular contact with existing clients to maintain our company's presence."
Sales Co-ordinator,Sudesh Chemicals Pvt. Ltd.,"Ahmedabad, Gujarat",N/A,"From ₹14,000",To ensure that order placed on principals and material received against this are matching and it also matches the average stock with us being maintained.
Hospital receptionist,KKR ENT HOSPITAL & RESEARCH INSTITUTE,"Kilpauk, Chennai, Tamil Nadu",Full-time ,N/A,"Job Types: Full-time, Permanent.
Microsoft Office: 1 year (Preferred).
Total work: 1 year (Preferred)."
Workshop Floor Supervisor,ANJIKAR AUTOMOBILES LLP,"Chandrapur, Maharashtra",N/A,N/A,"Looking for candidate with Technical education, who is eager to work, having good communication skill, convincing power and know basic of computer."
Sales & Marketing Executives - Pharma Company,NBHEALTHCARE,"Mohali, Punjab",N/A,"From ₹10,000","Handle Customer Complaints, provide appropriate solutions , follow up to ensure resolution and satisfy the customer.
Pharmaceutical sales: 1 year (Preferred)."
CDP Tandoor,Chapter Two,"Calangute, Goa",Full-time ,N/A,The foremost trait in the candidate should be the willingness and eagerness to learn and master the art of tandoor.
Company Secretary with 1 - 3 years experience,Sumangal Press Pvt. Ltd.,"Dadar, Mumbai, Maharashtra",Full-time ,N/A,"Preparing Minutes of various Meetings and maintaining recordings.
3 years post qualification experience required.
Co ordinating with lawyers for NCLT Matters."
Executive Proposal & Sales Support,Shubham Tanks and Liners Pvt Ltd,"Thane, Maharashtra",N/A,N/A,"Gather and analyze information to ensure proposals are tailored to the client’s needs and requirements.
Years of Experience* - 2 - 3 years."
"Freelance DSA, Python & problem solving trainer on-site",EdCEPT LEARNING PRIVATE LIMITED,"Hyderabad, Telangana",N/A,"₹25,000 - ₹35,000","Continuous Improvement: Stay up-to-date with the latest trends and best practices in DSA, Python, and problem-solving, and incorporate them into the training…"
Tele Marketing Executive,Yathirai.com,"Chennai, Tamil Nadu",Full-time ,N/A,"Attend incoming calls & Explain products & services.
To create day to day DB.
Total work: 1 year (Preferred).
Chennai, Tamil Nadu: Relocate before starting work…"
AutoCAD Draughtsman (Interiors),HOMZINTERIO,"Bengaluru, Karnataka",N/A,N/A,"Must have in-depth knowledge in Autocad design software.
Minimum 1 year and above required from Interior Designs Industry.
Total work: 2 years (Required)."
Instrument Technician,ESPURE WATER SOLUTIONS PRIVATE LIMITED,"Chennai, Tamil Nadu",N/A,"₹4,000 - ₹5,000","Install & Commission of Instruments at site.
Service of Instruments at Site.
Job Types: Full-time, Permanent."
Dentist,Minimally Invasive Clinics-MIC,"Bengaluru, Karnataka",Part-time ,N/A,"Doing tooth prep, basic RCt work and clinic management."
Staff Nurse,Medfin,"Seshadripuram, Bengaluru, Karnataka",Monday to Friday ,N/A,"Provide comprehensive nursing care to patients in the hospital wards, including monitoring vital signs, administering medications, and performing routine…"
Graphic Designer in Ahmedabad,Virtual Pebbles Digital,"Makarba, Ahmedabad, Gujarat",N/A,"₹12,000 - ₹20,000","The ideal candidate will have 2-3 years of experience in an agency environment.
Graphic design: 2 years (Required).
Total work: 2 years (Required)."
Architect,HOMZINTERIO,"HSR Layout Sector 1, Bengaluru, Karnataka",Full-time,N/A,"Designing floor plans for effectively utilizing the space, with understanding of interiors and keeping in mind the structural design nuances."
Lady warden,Blue Bells,"Shanthinagar, Bengaluru, Karnataka",N/A,N/A,Looking for a lady Manager / Warden for a reputed Girls PG in Shanthinagar. Accomodation + food + salary. Contact no - 9945027274. Job Type: Full-time Pay:…
Endodontist - Full time,Excellence Dental,"Indiranagar, Bengaluru, Karnataka",N/A,N/A,"Fresh graduates or those with limited experience are encouraged to apply.
Build positive relationships with patients, ensuring a comfortable and supportive…"
Field Sales Representative,FABRIZIO TRADELINK LLP,"Navapura, Ahmedabad, Gujarat",N/A,"₹2,00,000 - ₹4,00,000","THE IDEAL CANDIDATE WILL BE RESPONSIBLE FOR DEVELOPING AND EXECUTING MARKETING STRATEGIES TO PROMOTE OUR RANGE OF FURNISHING PRODUCTS, INCLUDING FURNISHING…"
Urgently Marathi Teacher Needed,Covo Del Bambino,"Sion, Mumbai, Maharashtra",Full-time,N/A,"Proficient in both ICSE and SSC syllabus.
Ability to teach students from Class 1 to 10.
Capable of conducting extra classes both online and offline."
AutoCAD Designer - Electrical,Kriyatech,"Malumichampatti, Coimbatore, Tamil Nadu",N/A,N/A,Experience: Minimum 1-3 years of experience working with AutoCAD Electrical in an engineering or design role.
Urgently Marathi Teacher Needed,Covo Del Bambino,"Sion, Mumbai, Maharashtra",N/A,"₹10,000 - ₹15,000","Proficient in both ICSE and SSC syllabus.
Ability to teach students from Class 1 to 10.
Capable of conducting extra classes both online and offline."
MBBS Requied,AddressHealth Solutions India Pvt Ltd,"Kalyan, Maharashtra",Full-time,N/A,"Total work: 3 years (Preferred).
Job Vacancy for MBBS Doctors for a Short term Health Checkup Program for reputed schools in Kalyan and Badlapur of Maharashtra."
Delivery Boy,Swiggy3.8,"Kochi, Kerala",N/A,N/A,"Ensure timely delivery, provide excellent customer service, and maintain a high level of professionalism.
As a Delivery Executive, you will pick up food orders…"
Female Retail Sales Executive,Jagdish Farshan Pvt Ltd,"Gotri, Vadodara, Gujarat",N/A,"₹2,000 - ₹2,500",Ensure high levels of customer satisfaction through excellent sales service · Assess customers needs and provide assistance and information.
Jewellery Sales Assistant,Dhruv Gold Silver & Diamond,"Karelibaug, Vadodara, Gujarat",Contractual / Temporary ,N/A,"Jeweller salesman with basic knowledge of gold and silver jewellery.
Job Types: Full-time, Permanent.
Total work: 1 year (Preferred)."
Electrical Technician,Kasco solutions,"Nadapuram, Kerala",N/A,N/A,"Nadapuram, Kerala: Reliably commute or planning to relocate before starting work (Required).
Total work: 2 years (Preferred)."
Staff Nurse,Athulya Assisted Living Pvt Ltd,"Chennai, Tamil Nadu",N/A,"₹35,000 - ₹40,000","Develop, implement and evaluate standard operating procedure, process, policies and standards for clinical functions.
Total work: 1 year (Preferred)."
Ayurveda RMO(Female),Vedam Ayurveda Multispeciality Hospital,"BTM Layout 1, Bengaluru, Karnataka",Full-time ,N/A,"Looking for a Female Ayurveda Physician with sound knowledge in Panchakarma treatments, taking care of on going schedule, assisting Sr,Consultants, therapist…"
Pre-Sales Loan Executive - Real Estate,PROPRISE Property Consulting Pvt ltd,"Pune, Maharashtra",N/A,N/A,"Explain how our solutions align with their pain points.
Stay up to date with the latest sales trends and best practices.
Expertise in Promoting the products."
Female Junior advocate and female finance executives,Sky Legal Consultants,"Mumbai, Maharashtra",N/A,"₹15,000 - ₹25,000",Financial product handling for financial Exc.
Salesman,SUMIRO TRENDS,"Parvat Patiya, Surat, Gujarat",Full-time ,N/A,Total work: 1 year (Required).
"Physics (Main) cum Chemistry Teacher (7th to 10th), CBSE, 7yrs of exp.","Neelkanth Vidyapeeth International School,...","Hayathnagar, Hyderabad, Telangana",N/A,N/A,"Effective communicative skills, knowledge of computer is a must.
Food and Accommodation is provided (as per the requirement-Only Male staff)."
Culinary Arts Lecturer - Chef,Kitcap,"Bengaluru, Karnataka",N/A,"₹12,000 - ₹30,000","Conducting engaging and informative classes that seamlessly integrate theoretical knowledge with practical, hands-on experience."
Salesman,SUMIRO TRENDS,"Parvat Patiya, Surat, Gujarat",N/A,"From ₹15,000",Total work: 1 year (Required).
"Physics (Main) cum Chemistry Teacher (7th to 10th), CBSE, 7yrs of exp.","Neelkanth Vidyapeeth International School,...","Hayathnagar, Hyderabad, Telangana",Full-time,N/A,"Effective communicative skills, knowledge of computer is a must.
Food and Accommodation is provided (as per the requirement-Only Male staff)."
Culinary Arts Lecturer - Chef,Kitcap,"Bengaluru, Karnataka",N/A,N/A,"Conducting engaging and informative classes that seamlessly integrate theoretical knowledge with practical, hands-on experience."
AutoCAD Designer - Electrical,Kriyatech,"Malumichampatti, Coimbatore, Tamil Nadu",N/A,"₹15,000 - ₹20,000",Experience: Minimum 1-3 years of experience working with AutoCAD Electrical in an engineering or design role.
Field Sales Representative,FABRIZIO TRADELINK LLP,"Navapura, Ahmedabad, Gujarat",Full-time,N/A,"THE IDEAL CANDIDATE WILL BE RESPONSIBLE FOR DEVELOPING AND EXECUTING MARKETING STRATEGIES TO PROMOTE OUR RANGE OF FURNISHING PRODUCTS, INCLUDING FURNISHING…"
Urgently Marathi Teacher Needed,Covo Del Bambino,"Sion, Mumbai, Maharashtra",N/A,N/A,"Proficient in both ICSE and SSC syllabus.
Ability to teach students from Class 1 to 10.
Capable of conducting extra classes both online and offline."
MBBS Requied,AddressHealth Solutions India Pvt Ltd,"Kalyan, Maharashtra",N/A,"₹20,000 - ₹40,000","Total work: 3 years (Preferred).
Job Vacancy for MBBS Doctors for a Short term Health Checkup Program for reputed schools in Kalyan and Badlapur of Maharashtra."
Female Retail Sales Executive,Jagdish Farshan Pvt Ltd,"Gotri, Vadodara, Gujarat",Full-time ,N/A,Ensure high levels of customer satisfaction through excellent sales service · Assess customers needs and provide assistance and information.
Jewellery Sales Assistant,Dhruv Gold Silver & Diamond,"Karelibaug, Vadodara, Gujarat",Monday to Friday ,N/A,"Jeweller salesman with basic knowledge of gold and silver jewellery.
Job Types: Full-time, Permanent.
Total work: 1 year (Preferred)."
Electrical Technician,Kasco solutions,"Nadapuram, Kerala",N/A,N/A,"Nadapuram, Kerala: Reliably commute or planning to relocate before starting work (Required).
Total work: 2 years (Preferred)."
Staff Nurse,Athulya Assisted Living Pvt Ltd,"Chennai, Tamil Nadu",N/A,"₹10,000 - ₹15,000","Develop, implement and evaluate standard operating procedure, process, policies and standards for clinical functions.
Total work: 1 year (Preferred)."
Ayurveda RMO(Female),Vedam Ayurveda Multispeciality Hospital,"BTM Layout 1, Bengaluru, Karnataka",Full-time,N/A,"Looking for a Female Ayurveda Physician with sound knowledge in Panchakarma treatments, taking care of on going schedule, assisting Sr,Consultants, therapist…"
Pre-Sales Loan Executive - Real Estate,PROPRISE Property Consulting Pvt ltd,"Pune, Maharashtra",N/A,N/A,"Explain how our solutions align with their pain points.
Stay up to date with the latest sales trends and best practices.
Expertise in Promoting the products."
Female Junior advocate and female finance executives,Sky Legal Consultants,"Mumbai, Maharashtra",N/A,"₹2,000 - ₹2,500",Financial product handling for financial Exc.
Salesman,SUMIRO TRENDS,"Parvat Patiya, Surat, Gujarat",Contractual / Temporary ,N/A,Total work: 1 year (Required).
"Data Scientist, India - BCG X",Boston Consulting Group4.2,"Gurugram, Haryana",N/A,N/A,"As a Data Scientist at BCG, you will collaborate on challenging projects to increasing your understanding of complex business problems from diverse perspectives…"
Culinary Arts Lecturer - Chef,Kitcap,"Bengaluru, Karnataka",N/A,"₹15,000 - ₹25,000","Conducting engaging and informative classes that seamlessly integrate theoretical knowledge with practical, hands-on experience."
"Physics (Main) cum Chemistry Teacher (7th to 10th), CBSE, 7yrs of exp.","Neelkanth Vidyapeeth International School,...","Hayathnagar, Hyderabad, Telangana",Full-time ,N/A,"Effective communicative skills, knowledge of computer is a must.
Food and Accommodation is provided (as per the requirement-Only Male staff)."
Endodontist - Full time,Excellence Dental,"Indiranagar, Bengaluru, Karnataka",N/A,"From ₹60,000","*Note:* This position is intended for those looking to grow with us over the long term.
Fresh graduates or those with limited experience are encouraged to…"
AutoCAD Designer - Electrical,Kriyatech,"Malumichampatti, Coimbatore, Tamil Nadu",Full-time,N/A,"Experience: Minimum 1-3 years of experience working with AutoCAD Electrical in an engineering or design role.
Pay: ₹15,000.00 - ₹20,000.00 per month."
Field Sales Representative,FABRIZIO TRADELINK LLP,"Navapura, Ahmedabad, Gujarat",N/A,N/A,"Pay: ₹20,000.00 - ₹40,000.00 per month.
COMPANY:- FABCASA TRADELINK LLP/FABRIZIO TRADELINK LLP.
ABOUT US:- FABCASA & FABRIZIO ARE A LEADING PROVIDER OF HIGH…"
Urgently Marathi Teacher Needed,Covo Del Bambino,"Sion, Mumbai, Maharashtra",N/A,"₹15,000 - ₹20,000","Interested candidates, please contact us at 9324739085 or visit our office at Covo Del Bambino, Sion, Mumbai.
Pay: ₹10,000.00 - ₹15,000.00 per month."
MBBS Requied,AddressHealth Solutions India Pvt Ltd,"Kalyan, Maharashtra",Full-time,N/A,"Work Timing: 8.30 am to 4.30 pm.
Total work: 3 years (Preferred).
Job Vacancy for MBBS Doctors for a Short term Health Checkup Program for reputed schools in…"
Female Retail Sales Executive,Jagdish Farshan Pvt Ltd,"Gotri, Vadodara, Gujarat",N/A,N/A,Ensure high levels of customer satisfaction through excellent sales service · Assess customers needs and provide assistance and information.
Jewellery Sales Assistant,Dhruv Gold Silver & Diamond,"Karelibaug, Vadodara, Gujarat",N/A,"₹20,000 - ₹40,000","Pay: ₹12,000.00 - ₹30,000.00 per month.
Jeweller salesman with basic knowledge of gold and silver jewellery.
Job Types: Full-time, Permanent."
Electrical Technician,Kasco solutions,"Nadapuram, Kerala",Full-time ,N/A,"Pay: ₹15,000.00 - ₹20,000.00 per month.
Small Electrical works,Inverter and Batteries fitting,solar installations,Cabling works etc."
Staff Nurse,Athulya Assisted Living Pvt Ltd,"Chennai, Tamil Nadu",Monday to Friday ,N/A,"Pay: ₹15,000.00 - ₹25,000.00 per month.
We are looking for female Bsc.,/GNM staffs for ATHULYA,.
Develop, implement and evaluate standard operating procedure,…"
Ayurveda RMO(Female),Vedam Ayurveda Multispeciality Hospital,"BTM Layout 1, Bengaluru, Karnataka",N/A,N/A,"Are you a BAMS Graduate.
Pay: ₹18,000.00 - ₹21,000.00 per month.
Looking for a Female Ayurveda Physician with sound knowledge in Panchakarma treatments, taking…"
Pre-Sales Loan Executive - Real Estate,PROPRISE Property Consulting Pvt ltd,"Pune, Maharashtra",N/A,"₹10,000 - ₹15,000","Explain how our solutions align with their pain points.
Stay up to date with the latest sales trends and best practices.
Expertise in Promoting the products."
Female Junior advocate and female finance executives,Sky Legal Consultants,"Mumbai, Maharashtra",Full-time,N/A,"Legal work for junior advocate.
Financial product handling for financial Exc.
Pay: ₹100,000.00 - ₹200,000.00 per year."
